[
  {
    "id": "item.pack.hiking",
    "name": "Hiking Pack",
    "class": "container",
    "size": { "w": 4, "h": 4 },
    "massKg": 1.1,
    "equipSlot": "back",
    "container": { "w": 6, "h": 8 }
  },
  {
    "id": "item.rig.chest",
    "name": "Chest Rig",
    "class": "container",
    "size": { "w": 3, "h": 3 },
    "massKg": 0.8,
    "equipSlot": "vest",
    "container": { "w": 5, "h": 3 }
  },
  {
    "id": "item.satchel.canvas",
    "name": "Canvas Satchel",
    "class": "container",
    "size": { "w": 3, "h": 2 },
    "massKg": 0.4,
    "equipSlot": "belt",
    "container": { "w": 4, "h": 3 }
  },
  {
    "id": "item.pouch.utility",
    "name": "Utility Pouch",
    "class": "container",
    "size": { "w": 2, "h": 2 },
    "massKg": 0.15,
    "container": { "w": 3, "h": 2 }
  }
]
